{
  "$schema": "https://json-schema.org/draft/2020-12/schema",
  "$id": "https://metolabs.dev/satcfdi-bridge/request-v1.schema.json",
  "title": "SATCFDI Bridge Request v1",
  "type": "object",
  "required": ["operation"],
  "additionalProperties": false,
  "properties": {
    "schema_version": {"const": "1.0"},
    "request_id": {"type": "string", "minLength": 1, "maxLength": 128},
    "operation": {"type": "string", "minLength": 1},
    "params": {"type": "object"}
  }
}
